---SnSf4OfUFfJmCxw1DZA, 0, , food, undefined 
--0uqWanwN31OkuuwJ1zjQ, 1, Le Gadboi: Poutine with pogos and onion rings., food, undefined 
--3gCyYz0Eo3r07tAvUbhg, 2, Their OMAKASE is AMAZING!!!!! Very recommended, food, undefined 
--3vR19cePIkGQBgcLsQkw, 3, Big steak omelette, food, undefined 
--7InqXrxwFUY6-ePZILpQ, 4, , food, undefined 
--9fNU-8m06bbXM3jIha_w, 5, Chocolate Cake 08/12/17 @endoedibles on Instagram for more, food, undefined 
--a8uNdcCabbj7HuhX9bVQ, 6, Garlic Sauce with Pork, food, undefined 
--Ae-P_qjpFDgaQHj2nauw, 7, , food, undefined 
--Be9sfiHG00D6eWN3jcpg, 8, From website. Desperately want this...now!, food, undefined 
--cBCIMbf6bu7_1t17PzgQ, 9, Inside mid afternoon., inside, undefined 
